{
  "schemaVersion": "1.0.0",
  "snapshotId": "00000000-0000-4000-8000-000000000002",
  "origin": "historical_transcription",
  "producer": {
    "name": "SilverGate fixture authoring",
    "version": "0.1.0",
    "collectorSetVersion": "fixture-1",
    "channel": "Development"
  },
  "captureWindow": {
    "startedAt": "2026-09-26T00:00:00Z",
    "endedAt": "2026-09-26T00:00:00Z"
  },
  "host": {
    "scopeId": "fixture-host",
    "reportedName": null,
    "osVersion": null,
    "runtimeVersion": null,
    "platform": {
      "osFamily": null,
      "architecture": null,
      "build": null,
      "releaseChannel": null,
      "runtimeEdition": null,
      "capturePrivilegeLevel": null
    },
    "fieldStates": {
      "/reportedName": {
        "state": "unknown",
        "reasonCode": "NOT_IN_FIXTURE"
      },
      "/osVersion": {
        "state": "unknown",
        "reasonCode": "NOT_IN_FIXTURE"
      },
      "/runtimeVersion": {
        "state": "unknown",
        "reasonCode": "NOT_IN_FIXTURE"
      },
      "/platform/osFamily": {
        "state": "unknown",
        "reasonCode": "NOT_IN_FIXTURE"
      },
      "/platform/architecture": {
        "state": "unknown",
        "reasonCode": "NOT_IN_FIXTURE"
      },
      "/platform/build": {
        "state": "unknown",
        "reasonCode": "NOT_IN_FIXTURE"
      },
      "/platform/releaseChannel": {
        "state": "unknown",
        "reasonCode": "NOT_IN_FIXTURE"
      },
      "/platform/runtimeEdition": {
        "state": "unknown",
        "reasonCode": "NOT_IN_FIXTURE"
      },
      "/platform/capturePrivilegeLevel": {
        "state": "unknown",
        "reasonCode": "NOT_IN_FIXTURE"
      }
    }
  },
  "sources": [
    {
      "sourceId": "source-1",
      "kind": "user_handoff",
      "label": "Sanitized user handoff transcription",
      "sourceHash": null,
      "originalObservationWindow": {
        "start": null,
        "end": null,
        "precision": "unknown"
      },
      "precision": "unknown",
      "fieldStates": {
        "/sourceHash": {
          "state": "not_collected",
          "reasonCode": "SOURCE_NOT_EMBEDDED"
        },
        "/originalObservationWindow/start": {
          "state": "unknown",
          "reasonCode": "TIME_NOT_RECORDED"
        },
        "/originalObservationWindow/end": {
          "state": "unknown",
          "reasonCode": "TIME_NOT_RECORDED"
        }
      }
    }
  ],
  "collectorRuns": [
    {
      "collectorRunId": "run-1",
      "collectorId": "fixture",
      "version": "1.0.0",
      "recordSchemaVersion": "1.0.0",
      "status": "partial",
      "startedAt": "2026-09-26T00:00:00Z",
      "endedAt": "2026-09-26T00:00:00Z",
      "durationMs": 0,
      "records": [
        "record-1",
        "record-2",
        "record-3",
        "record-4"
      ],
      "errors": [],
      "coverage": {
        "requestedScope": [
          "fixture"
        ],
        "completedScope": [
          "supplied_records"
        ],
        "missingScope": [
          "original_windows_query"
        ],
        "interval": {
          "start": null,
          "end": null,
          "precision": "unknown"
        },
        "completeness": "partial",
        "limitations": [
          "No current machine state is represented."
        ]
      },
      "metrics": {
        "recordCount": 4,
        "serializedBytes": null,
        "skippedCount": 0
      }
    }
  ],
  "records": [
    {
      "recordType": "historical_assertion",
      "payload": {
        "subject": "smart-connect",
        "statement": "The handoff records peer-A connecting to the SmartConnect listener at TCP 52492.",
        "reportedStatus": "fact",
        "originalEvidenceAvailable": false,
        "details": []
      },
      "recordId": "record-1",
      "collectorRunId": "run-1",
      "sourceId": "source-1",
      "recordSchemaVersion": "1.0.0",
      "observedWindow": {
        "start": null,
        "end": null,
        "precision": "unknown"
      },
      "fieldStates": {
        "/observedWindow/start": {
          "state": "unknown",
          "reasonCode": "TIME_NOT_RECORDED"
        },
        "/observedWindow/end": {
          "state": "unknown",
          "reasonCode": "TIME_NOT_RECORDED"
        }
      }
    },
    {
      "recordType": "historical_assertion",
      "payload": {
        "subject": "smart-connect",
        "statement": "The handoff records VaultPlugin initiating a connection to peer-B TCP 8009 and outbound Internet connections on TCP 5228.",
        "reportedStatus": "fact",
        "originalEvidenceAvailable": false,
        "details": []
      },
      "recordId": "record-2",
      "collectorRunId": "run-1",
      "sourceId": "source-1",
      "recordSchemaVersion": "1.0.0",
      "observedWindow": {
        "start": null,
        "end": null,
        "precision": "unknown"
      },
      "fieldStates": {
        "/observedWindow/start": {
          "state": "unknown",
          "reasonCode": "TIME_NOT_RECORDED"
        },
        "/observedWindow/end": {
          "state": "unknown",
          "reasonCode": "TIME_NOT_RECORDED"
        }
      }
    },
    {
      "recordType": "historical_assertion",
      "payload": {
        "subject": "smart-connect",
        "statement": "The handoff records loopback communication distinct from local-peer and Internet interactions.",
        "reportedStatus": "fact",
        "originalEvidenceAvailable": false,
        "details": []
      },
      "recordId": "record-3",
      "collectorRunId": "run-1",
      "sourceId": "source-1",
      "recordSchemaVersion": "1.0.0",
      "observedWindow": {
        "start": null,
        "end": null,
        "precision": "unknown"
      },
      "fieldStates": {
        "/observedWindow/start": {
          "state": "unknown",
          "reasonCode": "TIME_NOT_RECORDED"
        },
        "/observedWindow/end": {
          "state": "unknown",
          "reasonCode": "TIME_NOT_RECORDED"
        }
      }
    },
    {
      "recordType": "historical_assertion",
      "payload": {
        "subject": "smart-connect",
        "statement": "Neither peer-A nor peer-B has an established physical device identity.",
        "reportedStatus": "unknown",
        "originalEvidenceAvailable": false,
        "details": []
      },
      "recordId": "record-4",
      "collectorRunId": "run-1",
      "sourceId": "source-1",
      "recordSchemaVersion": "1.0.0",
      "observedWindow": {
        "start": null,
        "end": null,
        "precision": "unknown"
      },
      "fieldStates": {
        "/observedWindow/start": {
          "state": "unknown",
          "reasonCode": "TIME_NOT_RECORDED"
        },
        "/observedWindow/end": {
          "state": "unknown",
          "reasonCode": "TIME_NOT_RECORDED"
        }
      }
    }
  ],
  "privacy": {
    "policyVersion": "fixture-1",
    "omissions": [
      "Original command output, user paths, MAC addresses and PIDs."
    ],
    "redactions": [
      "Private peer addresses replaced by peer-A and peer-B; no physical identities inferred."
    ]
  },
  "integrity": {
    "algorithm": "SHA-256",
    "canonicalizationVersion": "sg-json-v1",
    "recordHashes": {
      "record-1": "daf0f3656fdfdd976a813a3b0a02c0859e6d7b82170b3908a71a7540db4026ec",
      "record-2": "d4e1ceed1b0bfe4757a7ba6031618853e60cd636ef945fcd1247465c84541e84",
      "record-3": "265ea3742f9796d674af2f553d4af5cf777dda3fadfe0fb77032b2906e5780f8",
      "record-4": "22cf4f6c8d89a114d9389dc8877b05835517a403b54baa56da120334ad23758c"
    },
    "manifestHash": "25b659842c0d0bbbd7a642c3ef93515920392c0f51724fb48358cf742742c8ec"
  }
}
