{
  "schemaVersion": "1.0.0",
  "snapshotId": "00000000-0000-4000-8000-000000000001",
  "origin": "historical_transcription",
  "producer": {
    "name": "SilverGate fixture authoring",
    "version": "0.1.0",
    "collectorSetVersion": "fixture-1",
    "channel": "Development"
  },
  "captureWindow": {
    "startedAt": "2026-09-26T00:00:00Z",
    "endedAt": "2026-09-26T00:00:00Z"
  },
  "host": {
    "scopeId": "fixture-host",
    "reportedName": null,
    "osVersion": null,
    "runtimeVersion": null,
    "platform": {
      "osFamily": null,
      "architecture": null,
      "build": null,
      "releaseChannel": null,
      "runtimeEdition": null,
      "capturePrivilegeLevel": null
    },
    "fieldStates": {
      "/reportedName": {
        "state": "unknown",
        "reasonCode": "NOT_IN_FIXTURE"
      },
      "/osVersion": {
        "state": "unknown",
        "reasonCode": "NOT_IN_FIXTURE"
      },
      "/runtimeVersion": {
        "state": "unknown",
        "reasonCode": "NOT_IN_FIXTURE"
      },
      "/platform/osFamily": {
        "state": "unknown",
        "reasonCode": "NOT_IN_FIXTURE"
      },
      "/platform/architecture": {
        "state": "unknown",
        "reasonCode": "NOT_IN_FIXTURE"
      },
      "/platform/build": {
        "state": "unknown",
        "reasonCode": "NOT_IN_FIXTURE"
      },
      "/platform/releaseChannel": {
        "state": "unknown",
        "reasonCode": "NOT_IN_FIXTURE"
      },
      "/platform/runtimeEdition": {
        "state": "unknown",
        "reasonCode": "NOT_IN_FIXTURE"
      },
      "/platform/capturePrivilegeLevel": {
        "state": "unknown",
        "reasonCode": "NOT_IN_FIXTURE"
      }
    }
  },
  "sources": [
    {
      "sourceId": "source-1",
      "kind": "user_handoff",
      "label": "Sanitized user handoff transcription",
      "sourceHash": null,
      "originalObservationWindow": {
        "start": null,
        "end": null,
        "precision": "unknown"
      },
      "precision": "unknown",
      "fieldStates": {
        "/sourceHash": {
          "state": "not_collected",
          "reasonCode": "SOURCE_NOT_EMBEDDED"
        },
        "/originalObservationWindow/start": {
          "state": "unknown",
          "reasonCode": "TIME_NOT_RECORDED"
        },
        "/originalObservationWindow/end": {
          "state": "unknown",
          "reasonCode": "TIME_NOT_RECORDED"
        }
      }
    }
  ],
  "collectorRuns": [
    {
      "collectorRunId": "run-1",
      "collectorId": "fixture",
      "version": "1.0.0",
      "recordSchemaVersion": "1.0.0",
      "status": "partial",
      "startedAt": "2026-09-26T00:00:00Z",
      "endedAt": "2026-09-26T00:00:00Z",
      "durationMs": 0,
      "records": [
        "record-1",
        "record-2",
        "record-3",
        "record-4",
        "record-5"
      ],
      "errors": [],
      "coverage": {
        "requestedScope": [
          "fixture"
        ],
        "completedScope": [
          "supplied_records"
        ],
        "missingScope": [
          "original_windows_query"
        ],
        "interval": {
          "start": null,
          "end": null,
          "precision": "unknown"
        },
        "completeness": "partial",
        "limitations": [
          "No current machine state is represented."
        ]
      },
      "metrics": {
        "recordCount": 5,
        "serializedBytes": null,
        "skippedCount": 0
      }
    }
  ],
  "records": [
    {
      "recordType": "historical_assertion",
      "payload": {
        "subject": "spotify",
        "statement": "The handoff records a loopback-only TCP listener at 127.0.0.1:7768 and wildcard IPv4 listener at 0.0.0.0:57621.",
        "reportedStatus": "fact",
        "originalEvidenceAvailable": false,
        "details": []
      },
      "recordId": "record-1",
      "collectorRunId": "run-1",
      "sourceId": "source-1",
      "recordSchemaVersion": "1.0.0",
      "observedWindow": {
        "start": null,
        "end": null,
        "precision": "unknown"
      },
      "fieldStates": {
        "/observedWindow/start": {
          "state": "unknown",
          "reasonCode": "TIME_NOT_RECORDED"
        },
        "/observedWindow/end": {
          "state": "unknown",
          "reasonCode": "TIME_NOT_RECORDED"
        }
      }
    },
    {
      "recordType": "historical_assertion",
      "payload": {
        "subject": "spotify",
        "statement": "The handoff records enabled Public inbound TCP and UDP Any-port rules with RemoteAddress Any.",
        "reportedStatus": "fact",
        "originalEvidenceAvailable": false,
        "details": []
      },
      "recordId": "record-2",
      "collectorRunId": "run-1",
      "sourceId": "source-1",
      "recordSchemaVersion": "1.0.0",
      "observedWindow": {
        "start": null,
        "end": null,
        "precision": "unknown"
      },
      "fieldStates": {
        "/observedWindow/start": {
          "state": "unknown",
          "reasonCode": "TIME_NOT_RECORDED"
        },
        "/observedWindow/end": {
          "state": "unknown",
          "reasonCode": "TIME_NOT_RECORDED"
        }
      }
    },
    {
      "recordType": "historical_assertion",
      "payload": {
        "subject": "spotify",
        "statement": "The handoff reports dynamic TCP/UDP port use; a single high port alone does not prove dynamic selection.",
        "reportedStatus": "fact",
        "originalEvidenceAvailable": false,
        "details": []
      },
      "recordId": "record-3",
      "collectorRunId": "run-1",
      "sourceId": "source-1",
      "recordSchemaVersion": "1.0.0",
      "observedWindow": {
        "start": null,
        "end": null,
        "precision": "unknown"
      },
      "fieldStates": {
        "/observedWindow/start": {
          "state": "unknown",
          "reasonCode": "TIME_NOT_RECORDED"
        },
        "/observedWindow/end": {
          "state": "unknown",
          "reasonCode": "TIME_NOT_RECORDED"
        }
      }
    },
    {
      "recordType": "historical_assertion",
      "payload": {
        "subject": "spotify",
        "statement": "Reported Query User rule names support a Windows user-consent origin inference.",
        "reportedStatus": "inference",
        "originalEvidenceAvailable": false,
        "details": []
      },
      "recordId": "record-4",
      "collectorRunId": "run-1",
      "sourceId": "source-1",
      "recordSchemaVersion": "1.0.0",
      "observedWindow": {
        "start": null,
        "end": null,
        "precision": "unknown"
      },
      "fieldStates": {
        "/observedWindow/start": {
          "state": "unknown",
          "reasonCode": "TIME_NOT_RECORDED"
        },
        "/observedWindow/end": {
          "state": "unknown",
          "reasonCode": "TIME_NOT_RECORDED"
        }
      }
    },
    {
      "recordType": "historical_assertion",
      "payload": {
        "subject": "spotify",
        "statement": "The physical identity of peer-B contacted at TCP 8009 remains unknown.",
        "reportedStatus": "unknown",
        "originalEvidenceAvailable": false,
        "details": []
      },
      "recordId": "record-5",
      "collectorRunId": "run-1",
      "sourceId": "source-1",
      "recordSchemaVersion": "1.0.0",
      "observedWindow": {
        "start": null,
        "end": null,
        "precision": "unknown"
      },
      "fieldStates": {
        "/observedWindow/start": {
          "state": "unknown",
          "reasonCode": "TIME_NOT_RECORDED"
        },
        "/observedWindow/end": {
          "state": "unknown",
          "reasonCode": "TIME_NOT_RECORDED"
        }
      }
    }
  ],
  "privacy": {
    "policyVersion": "fixture-1",
    "omissions": [
      "Original command output, user paths, MAC addresses and PIDs."
    ],
    "redactions": [
      "Private peer addresses replaced by peer-A and peer-B; no physical identities inferred."
    ]
  },
  "integrity": {
    "algorithm": "SHA-256",
    "canonicalizationVersion": "sg-json-v1",
    "recordHashes": {
      "record-1": "e8e7148a4cf3aaa7f0d36e284232dd23acf8d5845d5b7cd8f5f60d75dcc15b64",
      "record-2": "4d1fdf58511d71517860ca726f0f4eeccd78f2271b257b95792f4f10a9afa36e",
      "record-3": "47d526b32439cdba727f2c10da832ee553ef57438ba12c5973a0f5b5f816de1a",
      "record-4": "c4817aa48cb5ca64c2b4b078bca07a050a2a39e0c8701c0c5cb3ab018b2b6a79",
      "record-5": "fcab761a6b89a1603d7c2d59c24dd1ab5688082dd74b105363ecccfe4e21f935"
    },
    "manifestHash": "c2c073e168c01e8c1540abcdf476874d1bb574e9d049c5c12be0548f5036e08e"
  }
}
